tale_id,rights_status,content_description,set,sampling_version,type_count,collection,volume_no,source_ref,atu_labels_json,txt_path,text_raw,summary_norm,text_norm
era_vene_1_503_1,open,[Царевна-лягушка].,core,v1_20251230,3,"ERA, Vene",1,"ERA, Vene 1, 503/4 (1)","[""402""]",/Users/eugenia/Desktop/thesis/magic_tagger/data/processed/text_extraction/era_vene_1_503_1.txt,"Тили были царь с царицей у не
было три сына. Царица померла «яну
когда схоронили, то царь захотел женить
своих сыновей. Он послал их сперва испеч
три хлеба. Они пошли каждый во свою
сторону – Младшого стрела упала в
канаву старшего на юг а среднего на
льер. Младими пришел к конава и запло
хал. Лягушка выпрахнула из лужи
спросила что он плачет. Он рассказал ей
про свое горюшка. Она испекла дму
хорошие хлебы и велела итти домой.
Он отдал хлеб царю и царь взял
слей оде Царь велел шить каондом
по рубашки и они пошли отять
по своим дорогам. И опять младщего
сына рубашка оказалась, луче чемь
у старших. Тогда царь велел каждом
привести по невесть Каждый пошел
всвою сторону. Младшийсел у


канове и опять заплакал что его участь
брать гушку. Но лгумка выпрыгнула
из коновы и сказала, что она тоже
поедет. Лягушка опять куда то спрят
лась и вскоре явилась такой красавнцей
что Еванушка и глаза вытарачил.
Они посхали к царю и исрь онят
позвалис младшого сыно
Сыграли свадьбу и стали онить
и поживать и дабро наживать.


",царевна-лягушка.,"тили были царь с царицей у не было три сына. царица померла «яну когда схоронили, то царь захотел женить своих сыновей. он послал их сперва испеч три хлеба. они пошли каждый во свою сторону — младшого стрела упала в канаву старшего на юг а среднего на льер. младими пришел к конава и запло хал. лягушка выпрахнула из лужи спросила что он плачет. он рассказал ей про свое горюшка. она испекла дму хорошие хлебы и велела итти домой. он отдал хлеб царю и царь взял слей оде царь велел шить каондом по рубашки и они пошли отять по своим дорогам. и опять младщего сына рубашка оказалась, луче чемь у старших. тогда царь велел каждом привести по невесть каждый пошел всвою сторону. младшийсел у канове и опять заплакал что его участь брать гушку. но лгумка выпрыгнула из коновы и сказала, что она тоже поедет. лягушка опять куда то спрят лась и вскоре явилась такой красавнцей что еванушка и глаза вытарачил. они посхали к царю и исрь онят позвалис младшого сыно сыграли свадьбу и стали онить и поживать и дабро наживать."
era_vene_1_515_1,open,"[По пьяни мужик спорит, что сможет принести ночью с каменки камень. Идёт в баню, берёт камень, его кто-то хватает за руку. Слышит голос девушки, которая говорит, что отпустит, только если замуж возьмёт. Мужик соглашается, девушка отпускает.
Через время девушка является ему во сне, мучает его. Свадебный поезд останавливается у бани, выводят невесту из-под пола. Проклятая невеста не идёт в церковь. Говорит, что пусть поп кинет своего ребёнка в печь, потому что это подмёныш чертей, которые её в бани засадили. Поп слушается, мужик и проклятая девушка женятся.]",coverage,v1_20251230,1,"ERA, Vene",1,"ERA, Vene 1, 515/6 (1)","[""410""]",/Users/eugenia/Desktop/thesis/magic_tagger/data/processed/text_extraction/era_vene_1_515_1.txt,"Раз пяное, ребятище» подился.
что можит в 12 часов ночи принесо
с паменки камень. Уюшая он в баню
Как только взял он камень, по сразу
хвотил кто по ему за руку и не
пуснает. Пробыл он рваться, но не
что не помогасть. Вдруг послышился
голое девушки. Она ему сказала.
возми меня замуж, а если не возмень
то я тебя от сюда не пущу. Делать
было нечего. Он согласился ее взять.
замуж. Она его отпустила домой.
Пришая он домой и неможит


опомниться. Прошло несколько времени.
детище чтот уже все забыл. Серезжен
время стала девушка ему являтся восне
и говорила теже слова. Она ждовала ему
спокою. Пришлось ему мениться на пей
Запряти логадей и госхали гости за м
той. Жаних едит на передней готады. Вд
остановился ианих перед баней Всегоста
испугались и стали его спрашивать, что что
живет твоя невеста. Он ии рассказали похать
Вошли они в банюл вывечии под полка
красавицу – девушку, которая была проклята.
Поехали они в Церковь венчаться. Остановива
каго церкви, невеста не идет 1 церковъ. Она
сказала: Поди к попу, пуской оки нинут своего
ребенка в горячую печь, это черти им
принесли на место меня, а меня туда
в баню спесли а я уже там 10год жила.
Послушался попи сжок чертененка.
Они обынались и стали вместе мне
поживать.


","по пьяни мужик спорит, что сможет принести ночью с каменки камень. идет в баню, берет камень, его кто-то хватает за руку. слышит голос девушки, которая говорит, что отпустит, только если замуж возьмет. мужик соглашается, девушка отпускает. через время девушка является ему во сне, мучает его. свадебный поезд останавливается у бани, выводят невесту из-под пола. проклятая невеста не идет в церковь. говорит, что пусть поп кинет своего ребенка в печь, потому что это подменыш чертей, которые ее в бани засадили. поп слушается, мужик и проклятая девушка женятся.","раз пяное, ребятище» подился. что можит в 12 часов ночи принесо с паменки камень. уюшая он в баню как только взял он камень, по сразу хвотил кто по ему за руку и не пуснает. пробыл он рваться, но не что не помогасть. вдруг послышился голое девушки. она ему сказала. возми меня замуж, а если не возмень то я тебя от сюда не пущу. делать было нечего. он согласился ее взять. замуж. она его отпустила домой. пришая он домой и неможит опомниться. прошло несколько времени. детище чтот уже все забыл. серезжен время стала девушка ему являтся восне и говорила теже слова. она ждовала ему спокою. пришлось ему мениться на пей запряти логадей и госхали гости за м той. жаних едит на передней готады. вд остановился ианих перед баней всегоста испугались и стали его спрашивать, что что живет твоя невеста. он ии рассказали похать вошли они в банюл вывечии под полка красавицу — девушку, которая была проклята. поехали они в церковь венчаться. остановива каго церкви, невеста не идет 1 церковъ. она сказала: поди к попу, пуской оки нинут своего ребенка в горячую печь, это черти им принесли на место меня, а меня туда в баню спесли а я уже там 10год жила. послушался попи сжок чертененка. они обынались и стали вместе мне поживать."
era_vene_12_105_22,open,Снегурочка.,core,v1_20251230,3,"ERA, Vene",12,"ERA, Vene 12, 105 (22)","[""703*""]",/Users/eugenia/Desktop/thesis/magic_tagger/data/processed/text_extraction/era_vene_12_105_22.txt,"Сделали дети со снегу куклу.
В одного старина и старухи
не было детей, я старуха и
говоритя хотела бы я пожить.
с дятям, о 6ы не дам.
А дети то и услишали и
оорят: «Да изъ принесем валу
дятенка
Приняели ей куклу снежил,
а претенег люди дурани были,
ня понимали; поставили ей
к печки гретьея – ена и жаста


",снегурочка.,"сделали дети со снегу куклу. в одного старина и старухи не было детей, я старуха и говоритя хотела бы я пожить. с дятям, о 6ы не дам. а дети то и услишали и оорят: «да изъ принесем валу дятенка приняели ей куклу снежил, а претенег люди дурани были, ня понимали; поставили ей к печки гретьея — ена и жаста"
era_vene_12_137_98,open,Иван-дурак.,core,v1_20251230,4,"ERA, Vene",12,"ERA, Vene 12, 137/41 (98)","[""530""]",/Users/eugenia/Desktop/thesis/magic_tagger/data/processed/text_extraction/era_vene_12_137_98.txt,"Кил-был стажк. В яво бло
тра сегна. Миша, Гриша и
Занька-дурачек Стал отеяпо
лирать и наказывал: «Ходите
ияня на вогил караулить
дни. Пришла череда старшого
виши, ей и проси: “Ванюша,
ходи, покорауль тятно. Яле
Заверну краюку хлеба, ей и
це но мошлу и каразли там
ваю ногк.
Втору ночь приходи черяда
раши, ей тоже проси: Ва¬
пюшка схдивось покораци
тятю! Опять пошел Ваня
дуран на вошли.


третья череда пришла Ва¬
нюше самому. Во полночью
тятя яво и спрашивает, Поче¬
у ня ходю Граша да Ниша
а все тѣ ходишь
- Да яни боятся и на хочут
тябя тятя, каразлить
тогда отси и говори, коли
сто так то вот тябя от
еня подарой конь Сивка Бур
ка-вещая канорка. Коле тябе
о надо буде махни платко
да стукни камешкой. Н тябе
и прибяжи Сивка-Бурка – вещая
какорка, ты ей в одное ухо
войдіи, а в друго вон выдии
будешь те распрякрасный мо¬
одая! Сказавши ети слова
отся замомъ, а Ваня по¬
шел во свояи.


33 суседском царстье прослави¬
ас царека дочка и царь созвал¬
жаних к ей свотаться. Кто
де самолучший, того и уени
заръ на дочне своей.
бяшил и Ванюшка ехать. Лво
лошадь вперяду всех, выше
всех да шньге всех. И сам
ей красавияя красавцем Бвон
ная сошлдь кок подпрычне
к самому онну царевой дочки.
вно и поставила Ванютну
наником – вдавила ему
перетне и е0д и ей усканал.
Царева дошна и говори: Вечи-
за того красовца кому
лобпометила.
Вярнулис брашья Домой,
а Ваня пяти на пяги. Яму
братья и говоря: Быя уа¬


н однн в царевой дочи, яму
яно 6 поб кольцом тиснезла.
А Данька пяпей и лоб тоят
сой повязат и говори. Няя¬
ия тамочо быел». А братьяо
дюи, Дурачина впчискался, так
есть дягов цазевой дочне до
тябя.
А Ванька все свое; ня я ни
тамъ бал
-Молги дурень, говоря брашья,
ляжи сябе на пячи, не та
и там были, но не одному
царму дочку ня датать.
Дал царь приная, чтобра все
жаншхи собрались и е вегдяри
с кольцом на лбу скопились
вси у дворца, а колца нет
ни 6 кого. Ворщу, ляти кра¬
савля на коне и подходит


к царевой доже. Тут яна яму
Слоусила в метку перетень.
Делать нечево стали в сводь-
онъ готовится, надо было
дичи стрялять. Вси настря
гяли хороших птиц, а Ваня
все сорок да ворож. Свара
и плаче: “Няльзя же тябя
доченька задурска отдастья.
да делать нечево царское
слово было уж дадено и
иггзали сводобу, а братья
диву давались. Вот Ваня
дурак каку сябе нявесту
достал


",иван-дурак.,"кил-был стажк. в яво бло тра сегна. миша, гриша и занька-дурачек стал отеяпо лирать и наказывал: «ходите ияня на вогил караулить дни. пришла череда старшого виши, ей и проси: “ванюша, ходи, покорауль тятно. яле заверну краюку хлеба, ей и це но мошлу и каразли там ваю ногк. втору ночь приходи черяда раши, ей тоже проси: ва пюшка схдивось покораци тятю! опять пошел ваня дуран на вошли. третья череда пришла ва нюше самому. во полночью тятя яво и спрашивает, поче у ня ходю граша да ниша а все тѣ ходишь - да яни боятся и на хочут тябя тятя, каразлить тогда отси и говори, коли сто так то вот тябя от еня подарой конь сивка бур ка-вещая канорка. коле тябе о надо буде махни платко да стукни камешкой. н тябе и прибяжи сивка-бурка — вещая какорка, ты ей в одное ухо войдіи, а в друго вон выдии будешь те распрякрасный мо одая! сказавши ети слова отся замомъ, а ваня по шел во свояи. 33 суседском царстье прослави ас царека дочка и царь созвал жаних к ей свотаться. кто де самолучший, того и уени заръ на дочне своей. бяшил и ванюшка ехать. лво лошадь вперяду всех, выше всех да шньге всех. и сам ей красавияя красавцем бвон ная сошлдь кок подпрычне к самому онну царевой дочки. вно и поставила ванютну наником — вдавила ему перетне и е0д и ей усканал. царева дошна и говори: вечиза того красовца кому лобпометила. вярнулис брашья домой, а ваня пяти на пяги. яму братья и говоря: быя уа н однн в царевой дочи, яму яно 6 поб кольцом тиснезла. а данька пяпей и лоб тоят сой повязат и говори. няя ия тамочо быел». а братьяо дюи, дурачина впчискался, так есть дягов цазевой дочне до тябя. а ванька все свое; ня я ни тамъ бал -молги дурень, говоря брашья, ляжи сябе на пячи, не та и там были, но не одному царму дочку ня датать. дал царь приная, чтобра все жаншхи собрались и е вегдяри с кольцом на лбу скопились вси у дворца, а колца нет ни 6 кого. ворщу, ляти кра савля на коне и подходит к царевой доже. тут яна яму слоусила в метку перетень. делать нечево стали в сводьонъ готовится, надо было дичи стрялять. вси настря гяли хороших птиц, а ваня все сорок да ворож. свара и плаче: “няльзя же тябя доченька задурска отдастья. да делать нечево царское слово было уж дадено и иггзали сводобу, а братья диву давались. вот ваня дурак каку сябе нявесту достал"
