tale_id,rights_status,content_description,set,sampling_version,type_count,collection,volume_no,source_ref,atu_labels_json,txt_path,text_raw,summary_norm,text_norm
era_vene_16_744_22,open,[Якорий убивает змея].,core,v1_20251230,2,"ERA, Vene",16,"ERA, Vene 16, 744 (22)","[""300""]",/Users/eugenia/Desktop/thesis/magic_tagger/data/processed/text_extraction/era_vene_16_744_22.txt,". Тыл царь у няво была дочка.
На берег выходит змен и каподый день
далжны былу принасить я мус дя¬
ревни рябенка. Пришла очередь и
да царевой дочки. Она пришла
на берег села и стала плаказь
Вдруг появился Якорми с
ном на плечи. Он спрасм у зевы
что начему а на плачет Ана
сказала все пра своя горе. Вдруг
паявился змей и стал прибли
жатцакдевы. Ахарий Набеданосея
сняя меч с пляча и убей змея.


",якорий убивает змея.,. тыл царь у няво была дочка. на берег выходит змен и каподый день далжны былу принасить я мус дя ревни рябенка. пришла очередь и да царевой дочки. она пришла на берег села и стала плаказь вдруг появился якорми с ном на плечи. он спрасм у зевы что начему а на плачет ана сказала все пра своя горе. вдруг паявился змей и стал прибли жатцакдевы. ахарий набеданосея сняя меч с пляча и убей змея.
era_vene_16_548_4,open,"[Гармонист всречает девушку, которая говорит, что он теперь её жених. До свадьбы девушка остаётся лягушкой. На свадьбе лягушка обращается красавицей. После свадьбы она обращается кобылой, велит продать на ярмарке, но без узды, иначе останется кобылой. Продаёт её много раз - богатеет. Случайно продаёт вместе с уздечкой. Через три года идёт мельнику, кому продал чтобы жену забрать. Мельник не продаёт, узду не украсть, друг передаёт. Жена возвращается домой - тощая, и больше не оборачивается.]",core,v1_20251230,3,"ERA, Vene",16,"ERA, Vene 16, 548/51 (4)","[""402"", ""325""]",/Users/eugenia/Desktop/thesis/magic_tagger/data/processed/text_extraction/era_vene_16_548_4.txt,"я. Шли маладые мальцы с
монью и слышат что ва гу-
ни пляска. Другие та не паш
ли, а гарманиет та захатся
взглянуть. Вот думаю, кто
там такой. А там девушка
и гаварит яму: “Ну, говарит
топерь ты не уидешь, жаник
будешь мой! Патом на утро
пришли дамой с ейже. На


гое время она абаратилась легу
хай чон испужался, какая зета
калягуха. Живе, что не лягуха
и мегуха, что я буду делать?”, на
падушке сидить. Вот патом но
свадьбу итти и зетакая лягуха
сделалась красавицей и нашли.
На свадьбы стали все плясать и
явона красавица вышла плясать.
Народ весь удивляетца: как мах¬
не правай рукой, так утята
палу так и плывуть, как левой
рукой, так гуси. Все с удивлени
ем: “хоспади, хоспади, вот эонка
та напалась. Патом свадобу от¬
гулялие, пришли дамой, ана и
гаварит: Вот тпебуде
марка, я сделаюсь кабылай, а ты
идие и прадавай мяня, тольки
с уздой не прадавой, а то я


все астанусь кабылай. Так он уже
не раз вадшя се прадавать, сде¬
лался бакацом. Даже на ярмон-
не стали замецать, что зежа
такое. Вот раз он празабылся
и продай кабошу с уздой.
шоя дамой, ждать паждать.
а не являетца хазяйка явона…
Тагды атный три года и
гадался, чтто я ведь с уздой про-
дал». Нашол, которому хазя
ину то продал, туды. Пришол
и видя, что хазяин пыто мне
на ей (раньше хадили кразголе
с лошадью малоли). Тагды стал
прасить, что, прадай мнее
тукабылу Хазянн не прадай
яму набылы зетай. Тагды зан
слядить, как бы узду украсть
у зстакова хазяина. Самому


не пришлося, а адин был у няво
друг, который ему узду передал.
так яна опять пришла. Приш
ла одни кости, иомуценная. И
боли не стала обарадаватца.


","гармонист всречает девушку, которая говорит, что он теперь ее жених. до свадьбы девушка остается лягушкой. на свадьбе лягушка обращается красавицей. после свадьбы она обращается кобылой, велит продать на ярмарке, но без узды, иначе останется кобылой. продает ее много раз - богатеет. случайно продает вместе с уздечкой. через три года идет мельнику, кому продал чтобы жену забрать. мельник не продает, узду не украсть, друг передает. жена возвращается домой - тощая, и больше не оборачивается.","я. шли маладые мальцы с монью и слышат что ва гуни пляска. другие та не паш ли, а гарманиет та захатся взглянуть. вот думаю, кто там такой. а там девушка и гаварит яму: “ну, говарит топерь ты не уидешь, жаник будешь мой! патом на утро пришли дамой с ейже. на гое время она абаратилась легу хай чон испужался, какая зета калягуха. живе, что не лягуха и мегуха, что я буду делать? ”, на падушке сидить. вот патом но свадьбу итти и зетакая лягуха сделалась красавицей и нашли. на свадьбы стали все плясать и явона красавица вышла плясать. народ весь удивляетца: как мах не правай рукой, так утята палу так и плывуть, как левой рукой, так гуси. все с удивлени ем: “хоспади, хоспади, вот эонка та напалась. патом свадобу от гулялие, пришли дамой, ана и гаварит: вот тпебуде марка, я сделаюсь кабылай, а ты идие и прадавай мяня, тольки с уздой не прадавой, а то я все астанусь кабылай. так он уже не раз вадшя се прадавать, сде лался бакацом. даже на ярмонне стали замецать, что зежа такое. вот раз он празабылся и продай кабошу с уздой. шоя дамой, ждать паждать. а не являетца хазяйка явона. .. тагды атный три года и гадался, чтто я ведь с уздой продал». нашол, которому хазя ину то продал, туды. пришол и видя, что хазяин пыто мне на ей (раньше хадили кразголе с лошадью малоли). тагды стал прасить, что, прадай мнее тукабылу хазянн не прадай яму набылы зетай. тагды зан слядить, как бы узду украсть у зстакова хазяина. самому не пришлося, а адин был у няво друг, который ему узду передал. так яна опять пришла. приш ла одни кости, иомуценная. и боли не стала обарадаватца."
era_vene_2_161_14,open,Сказка про царей.,core,v1_20251230,6,"ERA, Vene",2,"ERA, Vene 2, 161/5 (14)","[""707""]",/Users/eugenia/Desktop/thesis/magic_tagger/data/processed/text_extraction/era_vene_2_161_14.txt,"

Жил царь с царицей и был у них
один сын. Они были уже старые
и говорят, чтобы собирался
сын ъ дорогу, искать себе же-
ну. Поехал молодой царевич,
едет и видит, три девицы
жнут ячмень на поле. Оста-
новился он и стал их спра-
шивать, что они умеют
делать. Одна и говорит Я одной


льнинкой все царство окручу"".
А вторая говорит: ""я одной
ржинкой все царство накорм-
лю"". А третья говорит: «Я
двенадцать сынов рожу. Во
лбу солнце, в затылке ме-
сяц по колена ноги в серебре
по локти руки золотые"".
По самым часты звездочки.
Взял царевич третью се-
стру, привез ее во дворец,
поквнчался и стали жить.
Нужно было ему уехать
далеко и оставил он свою
жену тяжелой. Уезжая,
приказал своей домовнице,
повестить его, когда кто
родится Домовница была
баба злая, завистливая.
Как родились двенадцать
свновей написала она моло


дому царю про его жену. «С ко
делями сука водилася, кобелят
и принесла: И просит его раз-
решения всех их с матерью по-
губить. Молодой царь отве-
чает, пусть они будут целы
и невредимы до его приезда.
Что тут было делать?
Решила домовница не уби-
вать их, а взяла большую
огроменную посудину, поса-
дили туда мать сдетьми
и пустили в море плыть.
Плывет посудина, а дети
о ней растут. Приплыла по-
судина к острову Вышла
из нее мать с сыновьями.
Как увидали жители такие
чудных молодцев, к себе жить
позвали. Как вечер гуляют
молодцы по улицам, так


и горят златом серебром.
Очень берегли их те люди, что
жили на остраве 33 эть
время молодой царь воз-
вращался домой и нужно
ему было ехать черу тот
Остров. Увидал он техмо-
ловусь и очень дивился. Стал
спрашивать Рассказали ему
что приплыла к острову
такая посудина, а 6 ней
баба и двенадцать сынов.
Прикатал молобой царь, что
бы повели его к той бабе
Тут узнал он свою жену
и что с ней приключилося
забрал своих детей и жену
и Бернулся, обратно в свое
жарство. Глузо же домов
ницу велел лютой казнью
казнить.


Люди ложь – и я тонсь.
казки конеу, а мне пива кариц.


",сказка про царей.,"жил царь с царицей и был у них один сын. они были уже старые и говорят, чтобы собирался сын ъ дорогу, искать себе жену. поехал молодой царевич, едет и видит, три девицы жнут ячмень на поле. остановился он и стал их спрашивать, что они умеют делать. одна и говорит я одной льнинкой все царство окручу"". а вторая говорит: ""я одной ржинкой все царство накормлю"". а третья говорит: «я двенадцать сынов рожу. во лбу солнце, в затылке месяц по колена ноги в серебре по локти руки золотые"". по самым часты звездочки. взял царевич третью сестру, привез ее во дворец, поквнчался и стали жить. нужно было ему уехать далеко и оставил он свою жену тяжелой. уезжая, приказал своей домовнице, повестить его, когда кто родится домовница была баба злая, завистливая. как родились двенадцать свновей написала она моло дому царю про его жену. «с ко делями сука водилася, кобелят и принесла: и просит его разрешения всех их с матерью погубить. молодой царь отвечает, пусть они будут целы и невредимы до его приезда. что тут было делать? решила домовница не убивать их, а взяла большую огроменную посудину, посадили туда мать сдетьми и пустили в море плыть. плывет посудина, а дети о ней растут. приплыла посудина к острову вышла из нее мать с сыновьями. как увидали жители такие чудных молодцев, к себе жить позвали. как вечер гуляют молодцы по улицам, так и горят златом серебром. очень берегли их те люди, что жили на остраве 33 эть время молодой царь возвращался домой и нужно ему было ехать черу тот остров. увидал он техмоловусь и очень дивился. стал спрашивать рассказали ему что приплыла к острову такая посудина, а 6 ней баба и двенадцать сынов. прикатал молобой царь, что бы повели его к той бабе тут узнал он свою жену и что с ней приключилося забрал своих детей и жену и бернулся, обратно в свое жарство. глузо же домов ницу велел лютой казнью казнить. люди ложь — и я тонсь. казки конеу, а мне пива кариц."
era_vene_2_622_5,open,Сказка об аленьком цветочке.,core,v1_20251230,2,"ERA, Vene",2,"ERA, Vene 2, 622/6 (5)","[""425C""]",/Users/eugenia/Desktop/thesis/magic_tagger/data/processed/text_extraction/era_vene_2_622_5.txt,"Жил был на свете старин со ста¬
рухой. У них было три дочки. Вот
однажды поехал мужик в город, на
Ярмарку и стал спрашивать,
кому что привести. Старшая
говорит: Приведи мне красного
шелка на юбку; вторая просит
мелку на платье, а меньшая го-
ворит: Мне аленький цветочек.
Бот и полхал, обит по бороге, ви¬
бит лес. Поехал скрозь мес дума
ет найдет там аленький цветог
В лесу напали на него воры и
отняли от него все. Он пошел
пешком. Бот идет и видит в
конце леса виднеется огонь. Он по


шел и пришел и видит замой
золотой. Он вошлел в саб, птички
поют, цзветы цветут, а уже вечер
Он нашел на бугорке аленький цве
ток. Пожалел не озял думает
он завянет. Пускай я утром возь
му. Вошел он  замок, там так
чисто, красиво, обошел весь, никого
нет. Он захотея кушать и ви
бит в другой комнате стол на
крыт ратными кушаньями. Он
покушал и захотел спать. По
шел в третью комнату и видит
питель ему убрана. Онлег и
заснул. Проснулся утром, пошел
6 сад сорвал аленький цветок
Как сорвал он цветок аленький,
как зашумело, как загремело
змен пополли и ктото началго-


говорить человеческим голосом
За что ты созевал цветок? За
то долиен ты прислать сюда
свою дочь суветком, я хогу ее по¬
смотреть, сказал ктото. Вот он вы¬
шес и пошел на дорогу. Видит стоят
его кони. Он сел и поехал. Приехал
домой и говорит старшей дочке.
Ступай туда, где я был. Мне
увет не нужени ты не для меня
его привел. Я не пойду! Вторая
бочка тоже не пошла. Третья
богка, для которой он привел цве
ток, согласилась и пошла. Пришла
и стала жить. Все готово, но ни
кого нет. Ктото говорит ей сдали
я буду с тобой всегда говорить,
но вон выходить не буду. Она же
отвечает; Выйди я хогу тебя


тебя посмотреть. Он говорит
Осли я покансусь, то спужа
еся. А она все просит, чтобы
вышел. Вотони вышел. Голова
у него была человеческая и всякого
зверя и такое же туловище. Так
он стал говорить с ней каждый
вечер. Вот она стала проситься
домой, а он ей и говорит я
пущу тебя на три дня, и в тре
тью ночь, в 12 часов приди сюда.
Если не прибешь, то я умру.
Вот она и пошла домой.
Пришла вся в золоте, да в серебре
такая красавица, нарядница. Вот
ей нужно было итти, а друже
сестры перевели часы и она про-
спала. Встала и пошла Пришла
и стала кликать. Ни кто не от


вечает. Вот она пошла 6 сади
видит на бугорке лежит умериии
Она его поцеловала и он обернулия
таким красавцем, что ни в сзазке
сказать. Тогда сыграли свадьбу
и стали жить да поживать, да
добра наживать.


",сказка об аленьком цветочке.,"жил был на свете старин со ста рухой. у них было три дочки. вот однажды поехал мужик в город, на ярмарку и стал спрашивать, кому что привести. старшая говорит: приведи мне красного шелка на юбку; вторая просит мелку на платье, а меньшая говорит: мне аленький цветочек. бот и полхал, обит по бороге, ви бит лес. поехал скрозь мес дума ет найдет там аленький цветог в лесу напали на него воры и отняли от него все. он пошел пешком. бот идет и видит в конце леса виднеется огонь. он по шел и пришел и видит замой золотой. он вошлел в саб, птички поют, цзветы цветут, а уже вечер он нашел на бугорке аленький цве ток. пожалел не озял думает он завянет. пускай я утром возь му. вошел он замок, там так чисто, красиво, обошел весь, никого нет. он захотея кушать и ви бит в другой комнате стол на крыт ратными кушаньями. он покушал и захотел спать. по шел в третью комнату и видит питель ему убрана. онлег и заснул. проснулся утром, пошел 6 сад сорвал аленький цветок как сорвал он цветок аленький, как зашумело, как загремело змен пополли и ктото началгоговорить человеческим голосом за что ты созевал цветок? за то долиен ты прислать сюда свою дочь суветком, я хогу ее по смотреть, сказал ктото. вот он вы шес и пошел на дорогу. видит стоят его кони. он сел и поехал. приехал домой и говорит старшей дочке. ступай туда, где я был. мне увет не нужени ты не для меня его привел. я не пойду! вторая бочка тоже не пошла. третья богка, для которой он привел цве ток, согласилась и пошла. пришла и стала жить. все готово, но ни кого нет. ктото говорит ей сдали я буду с тобой всегда говорить, но вон выходить не буду. она же отвечает; выйди я хогу тебя тебя посмотреть. он говорит осли я покансусь, то спужа еся. а она все просит, чтобы вышел. вотони вышел. голова у него была человеческая и всякого зверя и такое же туловище. так он стал говорить с ней каждый вечер. вот она стала проситься домой, а он ей и говорит я пущу тебя на три дня, и в тре тью ночь, в 12 часов приди сюда. если не прибешь, то я умру. вот она и пошла домой. пришла вся в золоте, да в серебре такая красавица, нарядница. вот ей нужно было итти, а друже сестры перевели часы и она проспала. встала и пошла пришла и стала кликать. ни кто не от вечает. вот она пошла 6 сади видит на бугорке лежит умериии она его поцеловала и он обернулия таким красавцем, что ни в сзазке сказать. тогда сыграли свадьбу и стали жить да поживать, да добра наживать."
