tale_id,rights_status,content_description,set,sampling_version,type_count,collection,volume_no,source_ref,atu_labels_json,txt_path,text_raw,summary_norm,text_norm
era_vene_13_28_3,open,"Мать-рысь, сжигают шкуру - остается человеком.",core,v1_20251230,3,"ERA, Vene",13,"ERA, Vene 13, 28/30 (3)","[""402""]",/Users/eugenia/Desktop/thesis/magic_tagger/data/processed/text_extraction/era_vene_13_28_3.txt,"5. Жила злошшая баба, была
в ей теронна дацка. В ктой
зацки был мужик. И был
в х припети робопьщык.
низлюбили гаразу баба терон
ну даук, напустила на
ону налдавство – убарашила
эму в рыею и выгнала ену
в поле. Некому рябонецка
меньгзыть, нашяели мамушку,
а была этоя мамушка добрая
и знало она все худый ба
ны дола тню ене мать
бення в рысю убыратила. Паш
мамушка с равенком из


хоть 6 поле закашей рабенон
исть, стал вапеть, а мамушка
и здагадалыся и закрычала:
рыея, рыся твая ден плоца,
исть коца. Услыхали то
с прибегла, шкурку свою
сбросила и стала кармить
рабеноцка. И мак ена делыла
какиный раз. Размужик вышна
на крылеу и услысала, как
мамка воня пысю, вскацым
в изьду, схватие сорянки и
набег в поле. Нашег в поли
каминь, нагарящил ево, надкрал
еек шкурки рыси и сжег
ену на камни. Бысякр
сваво рабенна вернулася
к тому месту, где свою
шкурку скинула и видее не шути
и, хошела бечь, а мужик


схватил ону в окаину. Шут
зацала всякой шварью
убарацываться, то в зняю, то
о мегушку и напаследок уберну
лася 6 вирятешко. Схватий
этое впрятешно они мужин,
разломая пополам и види не
автом канцы выросла белая
Беереза, а на другом сейдить
молодна. Взля он молодиу
за ослу руцыноку и навесе
дамой и стали ены жсить
да ложивать, да добра
вать.


","мать-рысь, сжигают шкуру - остается человеком.","5. жила злошшая баба, была в ей теронна дацка. в ктой зацки был мужик. и был в х припети робопьщык. низлюбили гаразу баба терон ну даук, напустила на ону налдавство — убарашила эму в рыею и выгнала ену в поле. некому рябонецка меньгзыть, нашяели мамушку, а была этоя мамушка добрая и знало она все худый ба ны дола тню ене мать бення в рысю убыратила. паш мамушка с равенком из хоть 6 поле закашей рабенон исть, стал вапеть, а мамушка и здагадалыся и закрычала: рыея, рыся твая ден плоца, исть коца. услыхали то с прибегла, шкурку свою сбросила и стала кармить рабеноцка. и мак ена делыла какиный раз. размужик вышна на крылеу и услысала, как мамка воня пысю, вскацым в изьду, схватие сорянки и набег в поле. нашег в поли каминь, нагарящил ево, надкрал еек шкурки рыси и сжег ену на камни. бысякр сваво рабенна вернулася к тому месту, где свою шкурку скинула и видее не шути и, хошела бечь, а мужик схватил ону в окаину. шут зацала всякой шварью убарацываться, то в зняю, то о мегушку и напаследок уберну лася 6 вирятешко. схватий этое впрятешно они мужин, разломая пополам и види не автом канцы выросла белая беереза, а на другом сейдить молодна. взля он молодиу за ослу руцыноку и навесе дамой и стали ены жсить да ложивать, да добра вать."
