tale_id,rights_status,content_description,set,sampling_version,type_count,collection,volume_no,source_ref,atu_labels_json,txt_path,text_raw,summary_norm,text_norm
tru_vkk_5_36_20,restricted_anon,"Кобылица-Луравица с двенацатимя жеребятами. [У деда с бабой три сына - два умных женатых, третий Иванушка дурачок холостой. Каждую ночь кто-то топчет пшеницу. Братья идут караулить, старшие спят и не видят кобылицу с двенадцатью жеребятами. Младший в карауле не спит, хватает одного жеребёнка, но отпускат, когда жеребица просит за услугу._x000D_
Царь отдат свою дочку за того, кто её на вышке поцелует. Старшие собираются, Иванушка идёт по грибы. В лесу призывает кобылицу, пролезает в ухо - делается красавцем. На кобылице допрыгивает до царевны и целует её. На второй день, царевна вбивает в лоб перстень. Иванушка завязывает лоб. Царь призывает всех мужчин, чтобы найти жениха. Дочки признаёт Иванушку по перстню, сняв повязку.]",core,v1_20251230,4,"TRÜ, VKK",5,"TRÜ, VKK 5, 36/43 (20)","[""530""]",/Users/eugenia/Desktop/thesis/magic_tagger/data/processed/text_extraction/tru_vkk_5_36_20.txt,"Жили -были у
Были у них три сына; Два
мных, тритий Шванушка у
рагон. Братья два ужапи¬
лися, а Иванушка дурагон
асталеся халастый. Пасеял
атль окала нса писниу.
и каждую почну кто-там
растотал паницу. Приде
ати к сннавьям и гаварить.
Ва шю, сынавья, пто-тaк
сторем наму планиицу. При-
ица вам Байти и кара-
уеить. Перебни танухи.
Капался большему брату
караупить. Пжишек
он к мсу, ж е ускул. а
ночью пришка набыница с
дынацатиня жеребятами


сама, как жар гари. И
больший праспал и ничаво
ни видал. Утром Браснулся,
рашие и затюшке и гава
рит:
С я, батюшка, никаво ни
видая.
5 другую ночь другому брату
ипи карациить. Втарой бра
пришее к лесу, лег и за¬
скул. Maк и пoт всс Браспах
и утром Браснулся, да ной
рашел и гаварит:
А я байюшка, никаво не
видая
ху что ж Капаю Иванушке
дурачку ити караупить.
Хримиея Шванушка и несу
сел и карацлит. А ночью
пришка кабылица с
запацатилия жередятами
сама как жар гарит,
и Даня не скол. Схватил


он однаво жерженна. Ка
былица Мваншку прасить
лютении голасон:
“Ты хоть што желай, я все
выполю, только наяво диты
ай. В Мванушка отпустил
днее кабылизы. Птром он
дамой рашья, вей байюш
не и братьям говарил.
А братья яму:
“Простафиля! Начему такую
ту трустил.
и на другой день царъ
абьявил вену гасудурству
что он хочет сваю дочку
жанитъ и приказал съехать
всен старым и нападын.
Догна находита на вышле
и кто яе в уста цяхует,
ралугает яе сяде жаной.
Братья тоже сабирались
райти к царю. В Ивануш
на-дурагой сказал жанал


братьев:
Дaйiе мне карзинку, я в
лес за гридам райду.
Жаны сказали:
“Ху и ты дурагон гриды
принесьм.
хо дали яну карзику. Ива
нушка дурачак ушее в не
карзинку раставил и гава
рит
“Грибки, гридки, наклады-
вайтесь сами, а мне добро
ну попоцу некагда.
и сам евискух. Пришла
кабылица, на калени вста-
ла, сказала
“13 рравую уху влезай, в ле
вую Былай
вамванушка 6 рравое
ухо всег, в левую вылези
дегался таким полощем,
что на 6 сказне сказывать,
ни проль написать.


Дабылиза яму.
“Садись, крете держись.
и расхали. Даганяки Зратыв.
Дочку царь на вышку паса-
дни. Присхали. и Иванум
на как на набылице прыл
нух, так дочну царя паця¬
равал и быстра
Все пригат яму:
Держи, держи
Я он уехал, снед прастые.
Пришцеиванушка ду
рагок на прежнее несто,
6 левое ухо выеч, о правое
вылся и зделался опять Ива-
нуткой. Он уждой схватил
и дамой рался.
Принил дамой, нарушк
Бон и ляжит там. Приде
братья, гаваря.
“А какой севодия добрый
молодеь был, дочку царя
раззялава


а Иванушка говорий:
А тоже тал бывaт.
Братья яму:
Простафиля, как ты там
ма быть.
утрам братья апять садира¬
юща итии к царю. А
нушка апять серасил у жал
карзинку и в лее пашьел.
Пришел вто место, свиснук.
Пришла набылица. На каке-
ни встала. Иваю 6 правое
ухо 6лез, в левое выле и зде¬
лался апять таким прасав-
цем, что ни 6 сказне сназать
ни пором написать. Сел на
набылицу и поехали. Еде
дагамяли братьев. Приха
ли к вышне. Иванушка
на набылище Брыгнул, дочну
царя кряню, вуста расця¬
ловал. а дочна царя перетень
взяла и прямо яму на юод.


и усхал, след Брастыл.
Все кричат
Держи, держи.
и яво уж нет.
Пришел на прежна место,
6 невое ухо всег, с
вын и сделахся Ивануш¬
кой. Он грибы схватил, да
ой рашье, на печку лег, а
лоо перевязал тряницей. Братья
приде, говорят ау, што
дели и слышали, ичто был
такой красавиз, кагорни рассзя-
но дочку тряно в уста.
и Иванушка все слыши
хойза яну перетень глядеть.
Глядит он, а тот сняйт как
агонь. Атеи яну.
“Мы ито, хочешь дом аожи¬
гать.
Лванушка быстра завязал
200.
ха другой день царь апять


приказал всем маладым и
старый радайти к нему. Стар
братья пашли к царю,
а ванюшка-дурачан е пини.
Было много народу, но ни
у наво не было знака от дог
ки царя. Настала очередь
Мванушки. Спрасили:
«“Начему у тебя лод перевязан.
Мванушка вчай
Разбил.
Дана царя сняла трятие
увидела перетень и узнала
яво. Данасики царю, што
нашки жаниха Царь при-
казал нести яво в даню, вылнть
и новый кастюль дать.
и патом он палугил долку
царя и царство и палт
ливо жить.
И сказне канец.


","кобылица-луравица с двенацатимя жеребятами. у деда с бабой три сына - два умных женатых, третий иванушка дурачок холостой. каждую ночь кто-то топчет пшеницу. братья идут караулить, старшие спят и не видят кобылицу с двенадцатью жеребятами. младший в карауле не спит, хватает одного жеребенка, но отпускат, когда жеребица просит за услугу. _x000d_ царь отдат свою дочку за того, кто ее на вышке поцелует. старшие собираются, иванушка идет по грибы. в лесу призывает кобылицу, пролезает в ухо - делается красавцем. на кобылице допрыгивает до царевны и целует ее. на второй день, царевна вбивает в лоб перстень. иванушка завязывает лоб. царь призывает всех мужчин, чтобы найти жениха. дочки признает иванушку по перстню, сняв повязку.","жили -были у были у них три сына; два мных, тритий шванушка у рагон. братья два ужапи лися, а иванушка дурагон асталеся халастый. пасеял атль окала нса писниу. и каждую почну кто-там растотал паницу. приде ати к сннавьям и гаварить. ва шю, сынавья, пто-тaк сторем наму планиицу. приица вам байти и карауеить. перебни танухи. капался большему брату караупить. пжишек он к мсу, ж е ускул. а ночью пришка набыница с дынацатиня жеребятами сама, как жар гари. и больший праспал и ничаво ни видал. утром браснулся, рашие и затюшке и гава рит: с я, батюшка, никаво ни видая. 5 другую ночь другому брату ипи карациить. втарой бра пришее к лесу, лег и за скул. maк и пoт всс браспах и утром браснулся, да ной рашел и гаварит: а я байюшка, никаво не видая ху что ж капаю иванушке дурачку ити караупить. хримиея шванушка и несу сел и карацлит. а ночью пришка кабылица с запацатилия жередятами сама как жар гарит, и даня не скол. схватил он однаво жерженна. ка былица мваншку прасить лютении голасон: “ты хоть што желай, я все выполю, только наяво диты ай. в мванушка отпустил днее кабылизы. птром он дамой рашья, вей байюш не и братьям говарил. а братья яму: “простафиля! начему такую ту трустил. и на другой день царъ абьявил вену гасудурству что он хочет сваю дочку жанитъ и приказал съехать всен старым и нападын. догна находита на вышле и кто яе в уста цяхует, ралугает яе сяде жаной. братья тоже сабирались райти к царю. в ивануш на-дурагой сказал жанал братьев: дaйiе мне карзинку, я в лес за гридам райду. жаны сказали: “ху и ты дурагон гриды принесьм. хо дали яну карзику. ива нушка дурачак ушее в не карзинку раставил и гава рит “грибки, гридки, накладывайтесь сами, а мне добро ну попоцу некагда. и сам евискух. пришла кабылица, на калени встала, сказала “13 рравую уху влезай, в ле вую былай вамванушка 6 рравое ухо всег, в левую вылези дегался таким полощем, что на 6 сказне сказывать, ни проль написать. дабылиза яму. “садись, крете держись. и расхали. даганяки зратыв. дочку царь на вышку пасадни. присхали. и иванум на как на набылице прыл нух, так дочну царя паця равал и быстра все пригат яму: держи, держи я он уехал, снед прастые. пришцеиванушка ду рагок на прежнее несто, 6 левое ухо выеч, о правое вылся и зделался опять ивануткой. он уждой схватил и дамой рался. принил дамой, нарушк бон и ляжит там. приде братья, гаваря. “а какой севодия добрый молодеь был, дочку царя раззялава а иванушка говорий: а тоже тал бывaт. братья яму: простафиля, как ты там ма быть. утрам братья апять садира юща итии к царю. а нушка апять серасил у жал карзинку и в лее пашьел. пришел вто место, свиснук. пришла набылица. на какени встала. иваю 6 правое ухо 6лез, в левое выле и зде лался апять таким прасавцем, что ни 6 сказне сназать ни пором написать. сел на набылицу и поехали. еде дагамяли братьев. приха ли к вышне. иванушка на набылище брыгнул, дочну царя кряню, вуста расця ловал. а дочна царя перетень взяла и прямо яму на юод. и усхал, след брастыл. все кричат держи, держи. и яво уж нет. пришел на прежна место, 6 невое ухо всег, с вын и сделахся ивануш кой. он грибы схватил, да ой рашье, на печку лег, а лоо перевязал тряницей. братья приде, говорят ау, што дели и слышали, ичто был такой красавиз, кагорни рассзяно дочку тряно в уста. и иванушка все слыши хойза яну перетень глядеть. глядит он, а тот сняйт как агонь. атеи яну. “мы ито, хочешь дом аожи гать. лванушка быстра завязал ха другой день царь апять приказал всем маладым и старый радайти к нему. стар братья пашли к царю, а ванюшка-дурачан е пини. было много народу, но ни у наво не было знака от дог ки царя. настала очередь мванушки. спрасили: «“начему у тебя лод перевязан. мванушка вчай разбил. дана царя сняла трятие увидела перетень и узнала яво. данасики царю, што нашки жаниха царь приказал нести яво в даню, вылнть и новый кастюль дать. и патом он палугил долку царя и царство и палт ливо жить. и сказне канец."
tru_vkk_5_58_29,restricted_anon,[Морозко].,core,v1_20251230,5,"TRÜ, VKK",5,"TRÜ, VKK 5, 58/62 (29)","[""480D*""]",/Users/eugenia/Desktop/thesis/magic_tagger/data/processed/text_extraction/tru_vkk_5_58_29.txt,"Жини-быки дед и зада
у них ды догна дедова до
и бабина дог. Бада очень непа
видека дедаву дочну и застав-
ляка многа радотать, а сваю
дог часкака и галубила.
В0 и гавари раз баба
“Зызи сваю дог на мароз,
но д я яе не видела.
Зичего делать ау, запрят
нашадя 6 сани и павсе яс.
лан и расиугил пад дерной.
ночью приходит маро и
сугий палицей ра дереву
и гаварии
Я пбя замарожу


и девогна гаварий
Марог, нароз, тедя бох
приние, немарос. меня.
Кажалоя мароъ девачку, дал
ей муду и валенки.
Пришел нароз втарай раз
и девачна гаварит:
“Мароз, нароз, тебя дох
прине, на нарось меня.
И пажалел мароз яе.
на третью ног апять нароз¬
приних. Ни нарозие девочну
а сундук полный сякровииз
яй приние.
и да он оронияда сваск
дочну. Ханании он не вытерт
и Басхал на то же неста,
куда аставил дог. И видей
сидит дог у сундука и пежди¬
рает драха Ениность и золопа,
«И атколь пое все то ятец
спрасил.
“А мне оох прискал.


Вздумал дд
“Тярерь та бода будит яю да
вольна. Павязу я дамой.
193
уная– сделая.
11
Бада дома узнала, как
спаелась дедова дог и 6се
нто с ной была.
“Хараша бы и моей догне
радахатиь. падумала дада
И ня слышила дедаба дог
больше грубех егов ио при-
как. Жина ана сковно
тиичка на боне. И при-
казала дата и сваю дог
тысти в ле на то же несто,
где разбахатьла дедава дог.
Наслушался дед и катые
Задину дог 6 не.
Там задина дог села
деревца и ждать село.
хо наступила, холадние
стака. Ночью марое прише
и стукнул палицей за деревцу.


чер какой тебя прислал
суда. Ты кто!
Нигав нарое ня сказал
и дивіонку на ражалех, ат
нарозил нос.
на снедующую пог опять
тарое пришел:
Чер тебя какой суда при¬
ская:
ня пажался марое девгон
ну, руки да ношки атноро
гля.
Бадова дог вся дражит, а
нароза прасть на сабираща.
Насиутила третья пог. И
апять нарое тут как бут.
и закричала бадова дог.
на наво.
и замирозил наро уову
дой.
и дома оада все жде
доч. ня выберпьла бада
приказала дда запряч


лошадь и пасхали 6 нес.
Ой. И што ан та ви
дя. Видя, шно занерзка
а бадава дог. Зарыда-
ла зада, утшал яво дед
Вдруг  зада тто видит:
Лежит рядом.
дочной сун-
дух. Абрадовалась бада¬
всначила и сундуку,ы
ла, и – ах бы бох най мт
теперь было
Ткрыла сундц и наветре
чу ей выпрыгнули жабы.
нспугалась ана, упала и
там же умярла.
А дед да яво дог щас
кива жить стаки.
щаскива жить стали и
скаске нанец настал.




",морозко.,"жини-быки дед и зада у них ды догна дедова до и бабина дог. бада очень непа видека дедаву дочну и заставляка многа радотать, а сваю дог часкака и галубила. в0 и гавари раз баба “зызи сваю дог на мароз, но д я яе не видела. зичего делать ау, запрят нашадя 6 сани и павсе яс. лан и расиугил пад дерной. ночью приходит маро и сугий палицей ра дереву и гаварии я пбя замарожу и девогна гаварий марог, нароз, тедя бох приние, немарос. меня. кажалоя мароъ девачку, дал ей муду и валенки. пришел нароз втарай раз и девачна гаварит: “мароз, нароз, тебя дох прине, на нарось меня. и пажалел мароз яе. на третью ног апять нароз приних. ни нарозие девочну а сундук полный сякровииз яй приние. и да он оронияда сваск дочну. ханании он не вытерт и басхал на то же неста, куда аставил дог. и видей сидит дог у сундука и пежди рает драха ениность и золопа, «и атколь пое все то ятец спрасил. “а мне оох прискал. вздумал дд “тярерь та бода будит яю да вольна. павязу я дамой. уная— сделая. бада дома узнала, как спаелась дедова дог и 6се нто с ной была. “хараша бы и моей догне радахатиь. падумала дада и ня слышила дедаба дог больше грубех егов ио прикак. жина ана сковно тиичка на боне. и приказала дата и сваю дог тысти в ле на то же несто, где разбахатьла дедава дог. наслушался дед и катые задину дог 6 не. там задина дог села деревца и ждать село. хо наступила, холадние стака. ночью марое прише и стукнул палицей за деревцу. чер какой тебя прислал суда. ты кто! нигав нарое ня сказал и дивіонку на ражалех, ат нарозил нос. на снедующую пог опять тарое пришел: чер тебя какой суда при ская: ня пажался марое девгон ну, руки да ношки атноро гля. бадова дог вся дражит, а нароза прасть на сабираща. насиутила третья пог. и апять нарое тут как бут. и закричала бадова дог. на наво. и замирозил наро уову дой. и дома оада все жде доч. ня выберпьла бада приказала дда запряч лошадь и пасхали 6 нес. ой. и што ан та ви дя. видя, шно занерзка а бадава дог. зарыдала зада, утшал яво дед вдруг зада тто видит: лежит рядом. дочной сундух. абрадовалась бада всначила и сундуку, ы ла, и — ах бы бох най мт теперь было ткрыла сундц и наветре чу ей выпрыгнули жабы. нспугалась ана, упала и там же умярла. а дед да яво дог щас кива жить стаки. щаскива жить стали и скаске нанец настал."
